{
    "schemaVersion":  2,
    "package":  "langgraph-checkpoint-sqlite",
    "version":  "3.1.0",
    "fileName":  "langgraph_checkpoint_sqlite-3.1.0-py3-none-any.whl",
    "sha256":  "cc9b40df0076feae8a9ad42ae713621b148b00ac23adc09dc1dc66090a46e5ad",
    "installMode":  "local-downloaded-wheel",
    "installedFromFileName":  "langgraph_checkpoint_sqlite-3.1.0-py3-none-any.whl",
    "installedWheelSha256":  "cc9b40df0076feae8a9ad42ae713621b148b00ac23adc09dc1dc66090a46e5ad",
    "downloadResolver":  "pip-configured-index",
    "installedDistributionName":  "langgraph-checkpoint-sqlite",
    "installedDistributionVersion":  "3.1.0",
    "pep610ArchiveSha256":  "cc9b40df0076feae8a9ad42ae713621b148b00ac23adc09dc1dc66090a46e5ad",
    "pep610UrlScheme":  "file",
    "pep610UrlRetained":  false,
    "installInvocation":  {
                              "executable":  "venv-python",
                              "arguments":  [
                                                "-m",
                                                "pip",
                                                "install",
                                                "\u003cDOWNLOADED_CHECKPOINT_WHEEL\u003e"
                                            ],
                              "requirementKind":  "local-wheel-file",
                              "indexResolutionAllowed":  false
                          }
}
